Authors	Title	Journal	Vol:Issue:Page	Year	Pubmed_Id	Citation_Number	Authors_Full_Name	First_Author	LastAuthor	Affiliations	Grants
Michel N, Goffinet C, Ganter K, Allespach I, Kewalramani VN, Saifuddin M, Littman DR, Greene WC, Goldsmith MA, Keppler OT	Human cyclin T1 expression ameliorates a T-cell-specific transcriptional limitation for HIV in transgenic rats, but is not sufficient for a spreading infection of prototypic R5 HIV-1 strains ex vivo.	Retrovirology	6:2	2009	19144136		Nico Michel, Christine Goffinet, Kerstin Ganter, Ina Allespach, Vineet N Kewalramani, Mohammed Saifuddin, Dan R Littman, Warner C Greene, Mark A Goldsmith, Oliver T Keppler	Nico Michel	Oliver T Keppler	Department of Virology, University of Heidelberg, 69120 Heidelberg, Germany. mail@nicomichel.de	Howard Hughes Medical Institute; 
Abbadessa G, Accolla R, Aiuti F, Albini A, Aldovini A, Alfano M, Antonelli G, Bartholomew C, Bentwich Z, Bertazzoni U, Berzofsky JA, Biberfeld P, Boeri E, Buonaguro L, Buonaguro FM, Bukrinsky M, Burny A, Caruso A, Cassol S, Chandra P, Ceccherini-Nelli L, Chieco-Bianchi L, Clerici M, Colombini-Hatch S, de Giuli Morghen C, de Maria A, de Rossi A, Dierich M, Della-Favera R, Dolei A, Douek D, Erfle V, Felber B, Fiorentini S, Franchini G, Gershoni JM, Gotch F, Green P, Greene WC, Hall W, Haseltine W, Jacobson S, Kallings LO, Kalyanaraman VS, Katinger H, Khalili K, Klein G, Klein E, Klotman M, Klotman P, Kotler M, Kurth R, Lafeuillade A, La Placa M, Lewis J, Lillo F, Lisziewicz J, Lomonico A, Lopalco L, Lori F, Lusso P, Macchi B, Malim M, Margolis L, Markham PD, McClure M, Miller N, Mingari MC, Moretta L, Noonan D, O'Brien S, Okamoto T, Pal R, Palese P, Panet A, Pantaleo G, Pavlakis G, Pistello M, Plotkin S, Poli G, Pomerantz R, Radaelli A, Robertguroff M, Roederer M, Sarngadharan MG, Schols D, Secchiero P, Shearer G, Siccardi A, Stevenson M, Svoboda J, Tartaglia J, Torelli G, Tornesello ML, Tschachler E, Vaccarezza M, Vallbracht A, van Lunzen J, Varnier O, Vicenzi E, von Melchner H, Witz I, Zagury D, Zagury JF, Zauli G, Zipeto D	Unsung hero Robert C. Gallo.	Science	323:5911:206-7	2009	19131607		Giovanni Abbadessa, Roberto Accolla, Fernando Aiuti, Adriana Albini, Anna Aldovini, Massimo Alfano, Guido Antonelli, Courtenay Bartholomew, Zvi Bentwich, Umberto Bertazzoni, Jay A Berzofsky, Peter Biberfeld, Enzo Boeri, Luigi Buonaguro, Franco M Buonaguro, Michael Bukrinsky, Arsène Burny, Arnaldo Caruso, Sharon Cassol, Prakash Chandra, Luca Ceccherini-Nelli, Luigi Chieco-Bianchi, Mario Clerici, Sandra Colombini-Hatch, Carlo de Giuli Morghen, Andrea de Maria, Anita de Rossi, Manfred Dierich, Riccardo Della-Favera, Antonina Dolei, Daniel Douek, Volker Erfle, Barbara Felber, Simona Fiorentini, Genoveffa Franchini, Jonathan M Gershoni, Frances Gotch, Patrick Green, Warner C Greene, William Hall, William Haseltine, Stephens Jacobson, Lars O Kallings, Vaniambadi S Kalyanaraman, Hermann Katinger, Kamel Khalili, George Klein, Eva Klein, Mary Klotman, Paul Klotman, Moshe Kotler, Reinhard Kurth, Alain Lafeuillade, Michelangelo La Placa, Jonathan Lewis, Flavia Lillo, Julianna Lisziewicz, Anita Lomonico, Lucia Lopalco, Franco Lori, Paolo Lusso, Beatrice Macchi, Michael Malim, Leonid Margolis, Phillip D Markham, Myra McClure, Nancy Miller, Maria C Mingari, Lorenzo Moretta, Douglas Noonan, Steve O'Brien, Takashi Okamoto, Ranajit Pal, Peter Palese, Amos Panet, Giuseppe Pantaleo, George Pavlakis, Mauro Pistello, Stanley Plotkin, Guido Poli, Roger Pomerantz, Antonia Radaelli, Marjorie Robertguroff, Mario Roederer, Mangalasseril G Sarngadharan, Dominique Schols, Paola Secchiero, Gene Shearer, Antonio Siccardi, Mario Stevenson, Jan Svoboda, Jim Tartaglia, Giuseppe Torelli, Maria Lina Tornesello, Erwin Tschachler, Mauro Vaccarezza, Angelika Vallbracht, Jan van Lunzen, Oliviero Varnier, Elisa Vicenzi, Harald von Melchner, Isaac Witz, Daniel Zagury, Jean-Francois Zagury, Giorgio Zauli, Donato Zipeto	Giovanni Abbadessa	Donato Zipeto		NA
LaRue RS, Andrésdóttir V, Blanchard Y, Conticello SG, Derse D, Emerman M, Greene WC, Jónsson SR, Landau NR, Löchelt M, Malik HS, Malim MH, Münk C, O'Brien SJ, Pathak VK, Strebel K, Wain-Hobson S, Yu XF, Yuhki N, Harris RS	Guidelines for naming nonprimate APOBEC3 genes and proteins.	J. Virol.	83:2:494-7	2009	18987154		Rebecca S LaRue, Valgerdur Andrésdóttir, Yannick Blanchard, Silvestro G Conticello, David Derse, Michael Emerman, Warner C Greene, Stefán R Jónsson, Nathaniel R Landau, Martin Löchelt, Harmit S Malik, Michael H Malim, Carsten Münk, Stephen J O'Brien, Vinay K Pathak, Klaus Strebel, Simon Wain-Hobson, Xiao-Fang Yu, Naoya Yuhki, Reuben S Harris	Rebecca S LaRue	Reuben S Harris	Department of Biochemistry, Molecular Biology and Biophysics, Institute for Molecular Virology, Beckman Center for Genome Engineering, Comparative and Molecular Biology Graduate Program, University of Minnesota, Minneapolis, Minnesota 55455, USA.	NA
Roan NR, Münch J, Arhel N, Mothes W, Neidleman J, Kobayashi A, Smith-McCune K, Kirchhoff F, Greene WC	The cationic properties of SEVI underlie its ability to enhance human immunodeficiency virus infection.	J. Virol.	83:1:73-80	2009	18945786		Nadia R Roan, Jan Münch, Nathalie Arhel, Walther Mothes, Jason Neidleman, Akiko Kobayashi, Karen Smith-McCune, Frank Kirchhoff, Warner C Greene	Nadia R Roan	Warner C Greene	Gladstone Institute of Virology and Immunology, University of California, P.O. Box 419100, San Francisco, CA 94141-9100, USA.	NIAID NIH HHS; 1R01AI067057-01A2
Greene WC, Debyser Z, Ikeda Y, Freed EO, Stephens E, Yonemoto W, Buckheit RW, Esté JA, Cihlar T	Novel targets for HIV therapy.	Antiviral Res.	80:3:251-65	2008	18789977		Warner C Greene, Zeger Debyser, Yasuhiro Ikeda, Eric O Freed, Edward Stephens, Wes Yonemoto, Robert W Buckheit, José A Esté, Tomas Cihlar	Warner C Greene	Tomas Cihlar	Gladstone Institute of Virology and Immunology, San Francisco, CA, USA.	NA
Santiago ML, Montano M, Benitez R, Messer RJ, Yonemoto W, Chesebro B, Hasenkrug KJ, Greene WC	Apobec3 encodes Rfv3, a gene influencing neutralizing antibody control of retrovirus infection.	Science	321:5894:1343-6	2008	18772436		Mario L Santiago, Mauricio Montano, Robert Benitez, Ronald J Messer, Wes Yonemoto, Bruce Chesebro, Kim J Hasenkrug, Warner C Greene	Mario L Santiago	Warner C Greene	Gladstone Institute of Virology and Immunology, San Francisco, CA 94158, USA.	NIAID NIH HHS; R01 AI065329-04
Fauci AS, Johnston MI, Dieffenbach CW, Burton DR, Hammer SM, Hoxie JA, Martin M, Overbaugh J, Watkins DI, Mahmoud A, Greene WC	HIV vaccine research: the way forward.	Science	321:5888:530-2	2008	18653883		Anthony S Fauci, Margaret I Johnston, Carl W Dieffenbach, Dennis R Burton, Scott M Hammer, James A Hoxie, Malcolm Martin, Julie Overbaugh, David I Watkins, Adel Mahmoud, Warner C Greene	Anthony S Fauci	Warner C Greene	National Institute of Allergy and Infectious Diseases, National Institutes of Health, 31 Center Drive, Bethesda, MD 20892, USA. afauci@niaid.nih.gov	NA
Cavrois M, Neidleman J, Greene WC	The achilles heel of the trojan horse model of HIV-1 trans-infection.	PLoS Pathog.	4:6:e1000051	2008	18584030		Marielle Cavrois, Jason Neidleman, Warner C Greene	Marielle Cavrois	Warner C Greene	Gladstone Institute of Virology and Immunology, San Francisco, California, United States of America.	NCRR NIH HHS; RR 18928-01
Kwon HS, Brent MM, Getachew R, Jayakumar P, Chen LF, Schnolzer M, McBurney MW, Marmorstein R, Greene WC, Ott M	Human immunodeficiency virus type 1 Tat protein inhibits the SIRT1 deacetylase and induces T cell hyperactivation.	Cell Host Microbe	3:3:158-67	2008	18329615		Hye-Sook Kwon, Michael M Brent, Ruth Getachew, Prerana Jayakumar, Lin-Feng Chen, Martina Schnolzer, Michael W McBurney, Ronen Marmorstein, Warner C Greene, Melanie Ott	Hye-Sook Kwon	Melanie Ott	Gladstone Institute of Virology and Immunology, University of California, San Francisco, CA 94158, USA.	NIAID NIH HHS; R56 AI067118-01A2
Chiu YL, Greene WC	The APOBEC3 cytidine deaminases: an innate defensive network opposing exogenous retroviruses and endogenous retroelements.	Annu. Rev. Immunol.	26:317-53	2008	18304004		Ya-Lin Chiu, Warner C Greene	Ya-Lin Chiu	Warner C Greene	Gladstone Institute of Virology and Immunology, San Francisco, California 94158, USA. ychiu@gladstone.ucsf.edu	NCRR NIH HHS; RR18928-01
Roan NR, Greene WC	A seminal finding for understanding HIV transmission.	Cell	131:6:1044-6	2007	18083095		Nadia R Roan, Warner C Greene	Nadia R Roan	Warner C Greene	Gladstone Institute of Virology and Immunology, University of California, San Francisco, 1650 Owens Street, San Francisco, CA 94158, USA. nroan@gladstone.ucsf.edu	NA
Greene WC	A history of AIDS: looking back to see ahead.	Eur. J. Immunol.	37 Suppl 1:S94-102	2007	17972351		Warner C Greene	Warner C Greene	Warner C Greene	Gladstone Institute of Virology and Immunology, University of California, San Francisco, CA 94158, USA. wgreene@gladstone.ucsf.edu	NICHD NIH HHS; HD40543
Goffinet C, Michel N, Allespach I, Tervo HM, Hermann V, Kräusslich HG, Greene WC, Keppler OT	Primary T-cells from human CD4/CCR5-transgenic rats support all early steps of HIV-1 replication including integration, but display impaired viral gene expression.	Retrovirology	4:53	2007	17655755		Christine Goffinet, Nico Michel, Ina Allespach, Hanna-Mari Tervo, Volker Hermann, Hans-Georg Kräusslich, Warner C Greene, Oliver T Keppler	Christine Goffinet	Oliver T Keppler	Department of Virology, University of Heidelberg, Heidelberg, Germany. Christine.goffinet@med.uni-heidelberg.de	NA
Williams SA, Greene WC	Regulation of HIV-1 latency by T-cell activation.	Cytokine	39:1:63-74	2007	17643313		Samuel A Williams, Warner C Greene	Samuel A Williams	Warner C Greene	Gladstone Institute of Virology and Immunology, University of California, 1650 Owens Street, San Francisco, CA 94158, USA.	NIAID NIH HHS; P01 AI058708-040002
Ellery PJ, Tippett E, Chiu YL, Paukovics G, Cameron PU, Solomon A, Lewin SR, Gorry PR, Jaworowski A, Greene WC, Sonza S, Crowe SM	The CD16+ monocyte subset is more permissive to infection and preferentially harbors HIV-1 in vivo.	J. Immunol.	178:10:6581-9	2007	17475889		Philip J Ellery, Emma Tippett, Ya-Lin Chiu, Geza Paukovics, Paul U Cameron, Ajantha Solomon, Sharon R Lewin, Paul R Gorry, Anthony Jaworowski, Warner C Greene, Secondo Sonza, Suzanne M Crowe	Philip J Ellery	Suzanne M Crowe	AIDS Pathogenesis and Clinical Research Program, Macfarlane Burnet Institute for Medical Research and Public Health, Melbourne, Victoria, Australia.	NA
Williams SA, Kwon H, Chen LF, Greene WC	Sustained induction of NF-kappa B is required for efficient expression of latent human immunodeficiency virus type 1.	J. Virol.	81:11:6043-56	2007	17376917		Samuel A Williams, Hakju Kwon, Lin-Feng Chen, Warner C Greene	Samuel A Williams	Warner C Greene	Gladstone Institute of Virology and Immunology, University of California San Francisco, 1650 Owens Street, San Francisco, CA 94158, USA.	NCRR NIH HHS; RR 892801
Soros VB, Greene WC	APOBEC3G and HIV-1: strike and counterstrike.	Curr HIV/AIDS Rep	4:1:3-9	2007	17338854		Vanessa B Soros, Warner C Greene	Vanessa B Soros	Warner C Greene		NA
Soros VB, Yonemoto W, Greene WC	Newly synthesized APOBEC3G is incorporated into HIV virions, inhibited by HIV RNA, and subsequently activated by RNase H.	PLoS Pathog.	3:2:e15	2007	17291161		Vanessa B Soros, Wes Yonemoto, Warner C Greene	Vanessa B Soros	Warner C Greene	Gladstone Institute of Virology and Immunology, San Francisco, California, United States of America.	NCRR NIH HHS; RR1 892801
Cavrois M, Neidleman J, Kreisberg JF, Greene WC	In vitro derived dendritic cells trans-infect CD4 T cells primarily with surface-bound HIV-1 virions.	PLoS Pathog.	3:1:e4	2007	17238285		Marielle Cavrois, Jason Neidleman, Jason F Kreisberg, Warner C Greene	Marielle Cavrois	Warner C Greene	Gladstone Institute of Virology and Immunology, University of California San Francisco, San Francisco, California, United States of America.	NCRR NIH HHS; RR 18928-01
Stopak KS, Chiu YL, Kropp J, Grant RM, Greene WC	Distinct patterns of cytokine regulation of APOBEC3G expression and activity in primary lymphocytes, macrophages, and dendritic cells.	J. Biol. Chem.	282:6:3539-46	2007	17110377		Kim S Stopak, Ya-Lin Chiu, Jerry Kropp, Robert M Grant, Warner C Greene	Kim S Stopak	Warner C Greene	Gladstone Institute of Virology and Immunology, University of California, San Francisco, California 94158, USA.	NIAID NIH HHS; R01 AI065329
Ahuja SK, Aiuti F, Berkhout B, Biberfeld P, Burton DR, Colizzi V, Deeks SG, Desrosiers RC, Dierich MP, Doms RW, Emerman M, Gallo RC, Girard M, Greene WC, Hoxie JA, Hunter E, Klein G, Korber B, Kuritzkes DR, Lederman MM, Malim MH, Marx PA, McCune JM, McMichael A, Miller C, Miller V, Montagnier L, Montefiori DC, Moore JP, Nixon DF, Overbaugh J, Pauza CD, Richman DD, Saag MS, Sattentau Q, Schooley RT, Shattock R, Shaw GM, Stevenson M, Trkola A, Wainberg MA, Weiss RA, Wolinsky S, Zack JA	A plea for justice for jailed medical workers.	Science	314:5801:924-5	2006	17062652		Sunil K Ahuja, Fernando Aiuti, Ben Berkhout, Peter Biberfeld, Dennis R Burton, Vittorio Colizzi, Steven G Deeks, Ronald C Desrosiers, Manfred P Dierich, Robert W Doms, Michael Emerman, Robert C Gallo, Marc Girard, Warner C Greene, James A Hoxie, Eric Hunter, George Klein, Bette Korber, Daniel R Kuritzkes, Michael M Lederman, Michael H Malim, Preston A Marx, Joseph M McCune, Andrew McMichael, Christopher Miller, Veronica Miller, Luc Montagnier, David C Montefiori, John P Moore, Douglas F Nixon, Julie Overbaugh, C David Pauza, Douglas D Richman, Michael S Saag, Quentin Sattentau, Robert T Schooley, Robin Shattock, George M Shaw, Mario Stevenson, Alexandra Trkola, Mark A Wainberg, Robin A Weiss, Steven Wolinsky, Jerome A Zack	Sunil K Ahuja	Jerome A Zack		NA
Chiu YL, Witkowska HE, Hall SC, Santiago M, Soros VB, Esnault C, Heidmann T, Greene WC	High-molecular-mass APOBEC3G complexes restrict Alu retrotransposition.	Proc. Natl. Acad. Sci. U.S.A.	103:42:15588-93	2006	17030807		Ya-Lin Chiu, H Ewa Witkowska, Steven C Hall, Mario Santiago, Vanessa B Soros, Cécile Esnault, Thierry Heidmann, Warner C Greene	Ya-Lin Chiu	Warner C Greene	Gladstone Institute of Virology and Immunology, 1650 Owens Street, San Francisco, CA 94158, USA.	NCRR NIH HHS; RR18928-01
O'Mahony A, Raber J, Montano M, Foehr E, Han V, Lu SM, Kwon H, LeFevour A, Chakraborty-Sett S, Greene WC	NF-kappaB/Rel regulates inhibitory and excitatory neuronal function and synaptic plasticity.	Mol. Cell. Biol.	26:19:7283-98	2006	16980629		Alison O'Mahony, Jacob Raber, Mauricio Montano, Erik Foehr, Victor Han, Shao-ming Lu, Hakju Kwon, Anthony LeFevour, Shikha Chakraborty-Sett, Warner C Greene	Alison O'Mahony	Warner C Greene	Gladstone Institute of Virology and Immunology, University of California, San Francisco, San Francisco, CA 94141, USA.	NCRR NIH HHS; C06 RR018928
Zimmerman ES, Sherman MP, Blackett JL, Neidleman JA, Kreis C, Mundt P, Williams SA, Warmerdam M, Kahn J, Hecht FM, Grant RM, de Noronha CM, Weyrich AS, Greene WC, Planelles V	Human immunodeficiency virus type 1 Vpr induces DNA replication stress in vitro and in vivo.	J. Virol.	80:21:10407-18	2006	16956949		Erik S Zimmerman, Michael P Sherman, Jana L Blackett, Jason A Neidleman, Christophe Kreis, Pamela Mundt, Samuel A Williams, Maria Warmerdam, James Kahn, Frederick M Hecht, Robert M Grant, Carlos M C de Noronha, Andrew S Weyrich, Warner C Greene, Vicente Planelles	Erik S Zimmerman	Vicente Planelles	Division of Cellular Biology and Immunology, Department of Pathology, University of Utah School of Medicine, Salt Lake City, Utah 84132, USA.	NA
Soros VB, Greene WC	APOBEC3G and HIV-1: strike and counterstrike.	Curr Infect Dis Rep	8:4:317-23	2006	16822376		Vanessa B Soros, Warner C Greene	Vanessa B Soros	Warner C Greene	Gladstone Institute of Virology and Immunology, Department of Medicine, University of California, San Francisco, 1650 Owens Street, CA 94158-2261, USA.	NA
Chiu YL, Greene WC	Multifaceted antiviral actions of APOBEC3 cytidine deaminases.	Trends Immunol.	27:6:291-7	2006	16678488		Ya-Lin Chiu, Warner C Greene	Ya-Lin Chiu	Warner C Greene	Gladstone Institute of Virology and Immunology, University of California, San Francisco, CA 94141-9100, USA.	NIAID NIH HHS; R01 AI065329-01
Kreisberg JF, Yonemoto W, Greene WC	Endogenous factors enhance HIV infection of tissue naive CD4 T cells by stimulating high molecular mass APOBEC3G complex formation.	J. Exp. Med.	203:4:865-70	2006	16606671		Jason F Kreisberg, Wes Yonemoto, Warner C Greene	Jason F Kreisberg	Warner C Greene	Gladstone Institute of Virology and Immunology, University of California, San Francisco, San Francisco, CA 94158, USA.	NIAID NIH HHS; R01 AI065329
Chandrasekar B, Mummidi S, Mahimainathan L, Patel DN, Bailey SR, Imam SZ, Greene WC, Valente AJ	Interleukin-18-induced human coronary artery smooth muscle cell migration is dependent on NF-kappaB- and AP-1-mediated matrix metalloproteinase-9 expression and is inhibited by atorvastatin.	J. Biol. Chem.	281:22:15099-109	2006	16554298		Bysani Chandrasekar, Srinivas Mummidi, Lenin Mahimainathan, Devang N Patel, Steven R Bailey, Syed Z Imam, Warner C Greene, Anthony J Valente	Bysani Chandrasekar	Anthony J Valente	Department of Veterans Affairs South Texas Veterans Health Care System, San Antonio, Texas 78229-4404, USA. chandraseka@uthscsa.edu	NHLBI NIH HHS; HL68020
Cavrois M, Neidleman J, Kreisberg JF, Fenard D, Callebaut C, Greene WC	Human immunodeficiency virus fusion to dendritic cells declines as cells mature.	J. Virol.	80:4:1992-9	2006	16439555		Marielle Cavrois, Jason Neidleman, Jason F Kreisberg, David Fenard, Christian Callebaut, Warner C Greene	Marielle Cavrois	Warner C Greene	Gladstone Institute of Virology and Immunology, 1650 Owens St., San Francisco, CA 94158, USA.	NIAID NIH HHS; R03 AI062263-01A
Chiu YL, Greene WC	APOBEC3 cytidine deaminases: distinct antiviral actions along the retroviral life cycle.	J. Biol. Chem.	281:13:8309-12	2006	16407183		Ya-Lin Chiu, Warner C Greene	Ya-Lin Chiu	Warner C Greene	Gladstone Institute of Virology and Immunology, University of California, San Francisco, CA 94141, USA.	NIAID NIH HHS; R01 AI065329
Williams SA, Chen LF, Kwon H, Ruiz-Jarabo CM, Verdin E, Greene WC	NF-kappaB p50 promotes HIV latency through HDAC recruitment and repression of transcriptional initiation.	EMBO J.	25:1:139-49	2006	16319923		Samuel A Williams, Lin-Feng Chen, Hakju Kwon, Carmen M Ruiz-Jarabo, Eric Verdin, Warner C Greene	Samuel A Williams	Warner C Greene	Gladstone Institute of Virology and Immunology, University of California, San Francisco, CA 94158, USA.	NA
Fenard D, Yonemoto W, de Noronha C, Cavrois M, Williams SA, Greene WC	Nef is physically recruited into the immunological synapse and potentiates T cell activation early after TCR engagement.	J. Immunol.	175:9:6050-7	2005	16237100		David Fenard, Wes Yonemoto, Carlos de Noronha, Marielle Cavrois, Samuel A Williams, Warner C Greene	David Fenard	Warner C Greene	Gladstone Institute of Virology and Immunology, University of California, 94158, USA.	NA
Chen LF, Williams SA, Mu Y, Nakano H, Duerr JM, Buckbinder L, Greene WC	NF-kappaB RelA phosphorylation regulates RelA acetylation.	Mol. Cell. Biol.	25:18:7966-75	2005	16135789		Lin-Feng Chen, Samuel A Williams, Yajun Mu, Hiroyasu Nakano, James M Duerr, Leonard Buckbinder, Warner C Greene	Lin-Feng Chen	Warner C Greene	Gladstone Institute of Virology and Immunology, 1650 Owens St., San Francisco, CA 94158, USA. lchen@gladstone.ucsf.edu	NCI NIH HHS; R01 CA89001-02
Kwon H, Ogle L, Benitez B, Bohuslav J, Montano M, Felsher DW, Greene WC	Lethal cutaneous disease in transgenic mice conditionally expressing type I human T cell leukemia virus Tax.	J. Biol. Chem.	280:42:35713-22	2005	16105841		Hakju Kwon, Louise Ogle, Bobby Benitez, Jan Bohuslav, Mauricio Montano, Dean W Felsher, Warner C Greene	Hakju Kwon	Warner C Greene	Gladstone Institute of Virology and Immunology, San Francisco, California 94158, USA.	NCI NIH HHS; R01CA89001
Chen LF, Greene WC	Assessing acetylation of NF-kappaB.	Methods	36:4:368-75	2005	16111893		Lin-Feng Chen, Warner C Greene	Lin-Feng Chen	Warner C Greene	Gladstone Institute of Virology and Immunology, University of California, San Francisco 94158, USA.	NCI NIH HHS; R01 CA89001-02
Williams SA, Greene WC	Host factors regulating post-integration latency of HIV.	Trends Microbiol.	13:4:137-9	2005	15817380		Samuel A F Williams, Warner C Greene	Samuel A F Williams	Warner C Greene	Gladstone Institute of Virology and Immunology, 1650 Owens Street, San Francisco, CA 94158, USA.	NA
Stopak K, Greene WC	Protecting APOBEC3G: a potential new target for HIV drug discovery.	Curr Opin Investig Drugs	6:2:141-7	2005	15751736		Kimberly Stopak, Warner C Greene	Kimberly Stopak	Warner C Greene	Gladstone Institute of Virology and Immunology, University of California, San Francisco, 1650 Owens Street, San Francisco, CA 9418, USA.	NA
Keppler OT, Allespach I, Schüller L, Fenard D, Greene WC, Fackler OT	Rodent cells support key functions of the human immunodeficiency virus type 1 pathogenicity factor Nef.	J. Virol.	79:3:1655-65	2005	15650191		Oliver T Keppler, Ina Allespach, Lismarie Schüller, David Fenard, Warner C Greene, Oliver T Fackler	Oliver T Keppler	Oliver T Fackler	Department of Virology, University of Heidelberg, Im Neuenheimer Feld 324, D-69120 Heidelberg, Germany. oliver_keppler@med.uni-heidelberg.de	NIMH NIH HHS; R01-MH64396
Yonezawa A, Cavrois M, Greene WC	Studies of ebola virus glycoprotein-mediated entry and fusion by using pseudotyped human immunodeficiency virus type 1 virions: involvement of cytoskeletal proteins and enhancement by tumor necrosis factor alpha.	J. Virol.	79:2:918-26	2005	15613320		Akihito Yonezawa, Marielle Cavrois, Warner C Greene	Akihito Yonezawa	Warner C Greene	Gladstone Institute of Virology and Immunology, 1650 Owens St., San Francisco, CA 94158, USA.	NICHD NIH HHS; P01 HD40543-03
Cavrois M, Neidleman J, Yonemoto W, Fenard D, Greene WC	HIV-1 virion fusion assay: uncoating not required and no effect of Nef on fusion.	Virology	328:1:36-44	2004	15380356		Marielle Cavrois, Jason Neidleman, Wes Yonemoto, David Fenard, Warner C Greene	Marielle Cavrois	Warner C Greene	Gladstone Institute of Virology and Immunology, University of California, San Francisco, CA 94141-9100, United States.	NICHD NIH HHS; P01 HD40543
Greene WC	The brightening future of HIV therapeutics.	Nat. Immunol.	5:9:867-71	2004	15334078		Warner C Greene	Warner C Greene	Warner C Greene	Gladstone Institute of Virology and Immunology, Department of Medicine, University of California, San Francisco, California 94141-9100, USA. wgreene@gladstone.ucsf.edu	NA
Greene WC	Redistricting the retroviral restriction factors.	Nat. Med.	10:8:778-80	2004	15286773		Warner C Greene	Warner C Greene	Warner C Greene		NA
Williams SA, Chen LF, Kwon H, Fenard D, Bisgrove D, Verdin E, Greene WC	Prostratin antagonizes HIV latency by activating NF-kappaB.	J. Biol. Chem.	279:40:42008-17	2004	15284245		Samuel A Williams, Lin-Feng Chen, Hakju Kwon, David Fenard, Dwayne Bisgrove, Eric Verdin, Warner C Greene	Samuel A Williams	Warner C Greene	Gladstone Institute of Virology and Immunology, University of California, San Francisco, San Francisco, California 94141, USA.	NA
Chen LF, Greene WC	Shaping the nuclear action of NF-kappaB.	Nat. Rev. Mol. Cell Biol.	5:5:392-401	2004	15122352		Lin-Feng Chen, Warner C Greene	Lin-Feng Chen	Warner C Greene	Gladstone Institute of Virology and Immunology, University of California, San Francisco, California 94141, USA.	NA
Bohuslav J, Chen LF, Kwon H, Mu Y, Greene WC	p53 induces NF-kappaB activation by an IkappaB kinase-independent mechanism involving phosphorylation of p65 by ribosomal S6 kinase 1.	J. Biol. Chem.	279:25:26115-25	2004	15073170		Jan Bohuslav, Lin-Feng Chen, Hakju Kwon, Yajun Mu, Warner C Greene	Jan Bohuslav	Warner C Greene	Gladstone Institute of Virology and Immunology and the Department of Medicine, University of California, San Francisco, California 94143-1234, USA.	NCI NIH HHS; R01CA089001
O'Mahony AM, Montano M, Van Beneden K, Chen LF, Greene WC	Human T-cell lymphotropic virus type 1 tax induction of biologically Active NF-kappaB requires IkappaB kinase-1-mediated phosphorylation of RelA/p65.	J. Biol. Chem.	279:18:18137-45	2004	14963024		Alison M O'Mahony, Mauricio Montano, Katrien Van Beneden, Lin-Feng Chen, Warner C Greene	Alison M O'Mahony	Warner C Greene	Gladstone Institute for Virology and Immunology, Department of Medicine, University of California, San Francisco, California 94141, USA.	NCI NIH HHS; R01CA89001
Schaeffer E, Soros VB, Greene WC	Compensatory link between fusion and endocytosis of human immunodeficiency virus type 1 in human CD4 T lymphocytes.	J. Virol.	78:3:1375-83	2004	14722292		Evelyne Schaeffer, Vanessa B Soros, Warner C Greene	Evelyne Schaeffer	Warner C Greene	Gladstone Institute of Virology and Immunology, University of California, San Francisco, California 94141, USA.	NCI NIH HHS; R01 CA86814
Cavrois M, Neidleman J, Bigos M, Greene WC	Fluorescence resonance energy transfer-based HIV-1 virion fusion assay.	Methods Mol. Biol.	263:333-44	2004	14976375		Marielle Cavrois, Jason Neidleman, Martin Bigos, Warner C Greene	Marielle Cavrois	Warner C Greene	Gladstone Institute of Virology and Immunology, University of California, San Francisco, CA, USA.	NA
Greene WC, Chen LF	Regulation of NF-kappaB action by reversible acetylation.	Novartis Found. Symp.	259:208-17; discussion 218-25	2004	15171256		Warner C Greene, Lin-feng Chen	Warner C Greene	Lin-feng Chen	Gladstone Institute of Virology and Immunology, University of California, San Francisco, San Francisco, CA 94141, USA.	NIMH NIH HHS; P30 MH59037
Greene WC	How resting T cells deMURR HIV infection.	Nat. Immunol.	5:1:18-9	2004	14699403		Warner C Greene	Warner C Greene	Warner C Greene		NA
