Authors	Title	Journal	Vol:Issue:Page	Year	Pubmed_Id	Citation_Number	Authors_Full_Name	First_Author	LastAuthor	Affiliations	Grants
Wylie KM, Truty RM, Sharpton TJ, Mihindukulasuriya KA, Zhou Y, Gao H, Sodergren E, Weinstock GM, Pollard KS	Novel bacterial taxa in the human microbiome.	PLoS ONE	7:6:e35294	2012	22719826		Kristine M Wylie, Rebecca M Truty, Thomas J Sharpton, Kathie A Mihindukulasuriya, Yanjiao Zhou, Hongyu Gao, Erica Sodergren, George M Weinstock, Katherine S Pollard	Kristine M Wylie	Katherine S Pollard	The Genome Institute, Washington University School of Medicine, St Louis, Missouri, United States of America. kwylie@genome.wustl.edu	NHGRI NIH HHS; U54HG004968
Burbano HA, Green RE, Maricic T, Lalueza-Fox C, de la Rasilla M, Rosas A, Kelso J, Pollard KS, Lachmann M, Pääbo S	Analysis of human accelerated DNA regions using archaic hominin genomes.	PLoS ONE	7:3:e32877	2012	22412940		Hernán A Burbano, Richard E Green, Tomislav Maricic, Carles Lalueza-Fox, Marco de la Rasilla, Antonio Rosas, Janet Kelso, Katherine S Pollard, Michael Lachmann, Svante Pääbo	Hernán A Burbano	Svante Pääbo	Max Planck Institute for Evolutionary Anthropology, Leipzig, Germany. hernan.a.burbano@googlemail.com	NIGMS NIH HHS; GM082901
Kostka D, Hubisz MJ, Siepel A, Pollard KS	The role of GC-biased gene conversion in shaping the fastest evolving regions of the human genome.	Mol. Biol. Evol.	29:3:1047-57	2012	22075116		Dennis Kostka, Melissa J Hubisz, Adam Siepel, Katherine S Pollard	Dennis Kostka	Katherine S Pollard	Gladstone Institute of Cardiovascular Disease, University of California, San Francisco, USA. dennis.kostka@gladstone.ucsf.edu	NIGMS NIH HHS; GM82901
Lindblad-Toh K, Garber M, Zuk O, Lin MF, Parker BJ, Washietl S, Kheradpour P, Ernst J, Jordan G, Mauceli E, Ward LD, Lowe CB, Holloway AK, Clamp M, Gnerre S, Alföldi J, Beal K, Chang J, Clawson H, Cuff J, Di Palma F, Fitzgerald S, Flicek P, Guttman M, Hubisz MJ, Jaffe DB, Jungreis I, Kent WJ, Kostka D, Lara M, Martins AL, Massingham T, Moltke I, Raney BJ, Rasmussen MD, Robinson J, Stark A, Vilella AJ, Wen J, Xie X, Zody MC, Baldwin J, Bloom T, Chin CW, Heiman D, Nicol R, Nusbaum C, Young S, Wilkinson J, Worley KC, Kovar CL, Muzny DM, Gibbs RA, Cree A, Dihn HH, Fowler G, Jhangiani S, Joshi V, Lee S, Lewis LR, Nazareth LV, Okwuonu G, Santibanez J, Warren WC, Mardis ER, Weinstock GM, Wilson RK, Delehaunty K, Dooling D, Fronik C, Fulton L, Fulton B, Graves T, Minx P, Sodergren E, Birney E, Margulies EH, Herrero J, Green ED, Haussler D, Siepel A, Goldman N, Pollard KS, Pedersen JS, Lander ES, Kellis M	A high-resolution map of human evolutionary constraint using 29 mammals.	Nature	478:7370:476-82	2011	21993624		Kerstin Lindblad-Toh, Manuel Garber, Or Zuk, Michael F Lin, Brian J Parker, Stefan Washietl, Pouya Kheradpour, Jason Ernst, Gregory Jordan, Evan Mauceli, Lucas D Ward, Craig B Lowe, Alisha K Holloway, Michele Clamp, Sante Gnerre, Jessica Alföldi, Kathryn Beal, Jean Chang, Hiram Clawson, James Cuff, Federica Di Palma, Stephen Fitzgerald, Paul Flicek, Mitchell Guttman, Melissa J Hubisz, David B Jaffe, Irwin Jungreis, W James Kent, Dennis Kostka, Marcia Lara, Andre L Martins, Tim Massingham, Ida Moltke, Brian J Raney, Matthew D Rasmussen, Jim Robinson, Alexander Stark, Albert J Vilella, Jiayu Wen, Xiaohui Xie, Michael C Zody, Jen Baldwin, Toby Bloom, Chee Whye Chin, Dave Heiman, Robert Nicol, Chad Nusbaum, Sarah Young, Jane Wilkinson, Kim C Worley, Christie L Kovar, Donna M Muzny, Richard A Gibbs, Andrew Cree, Huyen H Dihn, Gerald Fowler, Shalili Jhangiani, Vandita Joshi, Sandra Lee, Lora R Lewis, Lynne V Nazareth, Geoffrey Okwuonu, Jireh Santibanez, Wesley C Warren, Elaine R Mardis, George M Weinstock, Richard K Wilson, Kim Delehaunty, David Dooling, Catrina Fronik, Lucinda Fulton, Bob Fulton, Tina Graves, Patrick Minx, Erica Sodergren, Ewan Birney, Elliott H Margulies, Javier Herrero, Eric D Green, David Haussler, Adam Siepel, Nick Goldman, Katherine S Pollard, Jakob S Pedersen, Eric S Lander, Manolis Kellis	Kerstin Lindblad-Toh	Manolis Kellis	Broad Institute of Harvard and Massachusetts Institute of Technology, 7 Cambridge Center, Cambridge, Massachusetts 02142, USA. kersli@broadinstitute.org	Howard Hughes Medical Institute; 
Kembel SW, Eisen JA, Pollard KS, Green JL	The phylogenetic diversity of metagenomes.	PLoS ONE	6:8:e23214	2011	21912589		Steven W Kembel, Jonathan A Eisen, Katherine S Pollard, Jessica L Green	Steven W Kembel	Jessica L Green	Institute of Ecology and Evolution, University of Oregon, Eugene, Oregon, United States of America. skembel@uoregon.edu	NA
Katzman S, Capra JA, Haussler D, Pollard KS	Ongoing GC-biased evolution is widespread in the human genome and enriched near recombination hot spots.	Genome Biol Evol	3:614-26	2011	21697099		Sol Katzman, John A Capra, David Haussler, Katherine S Pollard	Sol Katzman	Katherine S Pollard	Center for Biomolecular Science and Engineering, University of California, Santa Cruz, USA.	Howard Hughes Medical Institute; 
Capra JA, Pollard KS	Substitution patterns are GC-biased in divergent sequences across the metazoans.	Genome Biol Evol	3:516-27	2011	21670083		John A Capra, Katherine S Pollard	John A Capra	Katherine S Pollard	Gladstone Institutes, University of California, San Francisco, USA.	NIGMS NIH HHS; GM82901
Hirschey MD, Shimazu T, Capra JA, Pollard KS, Verdin E	SIRT1 and SIRT3 deacetylate homologous substrates: AceCS1,2 and HMGCS1,2.	Aging (Albany NY)	3:6:635-42	2011	21701047		Matthew D Hirschey, Tadahiro Shimazu, John A Capra, Katherine S Pollard, Eric Verdin	Matthew D Hirschey	Eric Verdin	Gladstone Institute of Virology and Immunology, University of California, San Francisco, CA 94158, USA.	NCRR NIH HHS; RR18928-01
Lambert N, Lambot MA, Bilheu A, Albert V, Englert Y, Libert F, Noel JC, Sotiriou C, Holloway AK, Pollard KS, Detours V, Vanderhaeghen P	Genes expressed in specific areas of the human fetal cerebral cortex display distinct patterns of evolution.	PLoS ONE	6:3:e17753	2011	21445258		Nelle Lambert, Marie-Alexandra Lambot, Angéline Bilheu, Valérie Albert, Yvon Englert, Frédérick Libert, Jean-Christophe Noel, Christos Sotiriou, Alisha K Holloway, Katherine S Pollard, Vincent Detours, Pierre Vanderhaeghen	Nelle Lambert	Pierre Vanderhaeghen	Institut de Recherches en Biologie Humaine et Moléculaire (IRIBHM), Université Libre de Bruxelles, Brussels, Belgium.	NA
Sharpton TJ, Riesenfeld SJ, Kembel SW, Ladau J, O'Dwyer JP, Green JL, Eisen JA, Pollard KS	PhylOTU: a high-throughput procedure quantifies microbial community diversity and resolves novel taxa from metagenomic data.	PLoS Comput. Biol.	7:1:e1001061	2011	21283775		Thomas J Sharpton, Samantha J Riesenfeld, Steven W Kembel, Joshua Ladau, James P O'Dwyer, Jessica L Green, Jonathan A Eisen, Katherine S Pollard	Thomas J Sharpton	Katherine S Pollard	The J. David Gladstone Institutes, University of California San Francisco, San Francisco, California, United States of America. thomas.sharpton@gladstone.ucsf.edu	NA
Capra JA, Pollard KS, Singh M	Novel genes exhibit distinct patterns of function acquisition and network integration.	Genome Biol.	11:12:R127	2010	21187012		John A Capra, Katherine S Pollard, Mona Singh	John A Capra	Mona Singh	Gladstone Institutes, University of California, San Francisco, 1650 Owens St, San Francisco, CA 94158, USA. tony.capra@gladstone.ucsf.edu	NHGRI NIH HHS; T32 HG003284
Hubisz MJ, Pollard KS, Siepel A	PHAST and RPHAST: phylogenetic analysis with space/time models.	Brief. Bioinformatics	12:1:41-51	2011	21278375		Melissa J Hubisz, Katherine S Pollard, Adam Siepel	Melissa J Hubisz	Adam Siepel	Department of Biological Statistics and Computational Biology, Cornell University, Ithaca, NY 14853, USA. acs4@cornell.edu	NIGMS NIH HHS; R01-GM082901
Kostka D, Hahn MW, Pollard KS	Noncoding sequences near duplicated genes evolve rapidly.	Genome Biol Evol	2:518-33	2010	20660939		Dennis Kostka, Matthew W Hahn, Katherine S Pollard	Dennis Kostka	Katherine S Pollard	Gladstone Institute for Cardiovascular Disease, Gladstone Institutes, University of California-San Francisco, San Francisco, CA, USA. dennis.kostka@gladstone.ucsf.edu	NIGMS NIH HHS; GM82901
Ritter DI, Li Q, Kostka D, Pollard KS, Guo S, Chuang JH	The importance of being cis: evolution of orthologous fish and mammalian enhancer activity.	Mol. Biol. Evol.	27:10:2322-32	2010	20494938		Deborah I Ritter, Qiang Li, Dennis Kostka, Katherine S Pollard, Su Guo, Jeffrey H Chuang	Deborah I Ritter	Jeffrey H Chuang	Department of Biology, Boston College, Chestnut Hill, Massachusetts, USA.	NINDS NIH HHS; NS042626
Katzman S, Kern AD, Pollard KS, Salama SR, Haussler D	GC-biased evolution near human accelerated regions.	PLoS Genet.	6:5:e1000960	2010	20502635		Sol Katzman, Andrew D Kern, Katherine S Pollard, Sofie R Salama, David Haussler	Sol Katzman	David Haussler	Department of Biomolecular Engineering, University of California Santa Cruz, Santa Cruz, California, United States of America.	Howard Hughes Medical Institute; 
Taylor SL, Pollard KS	Composite interval mapping to identify quantitative trait loci for point-mass mixture phenotypes.	Genet Res (Camb)	92:1:39-53	2010	20196895		Sandra L Taylor, Katherine S Pollard	Sandra L Taylor	Katherine S Pollard	Biostatistics Graduate Group, University of California-Davis, One Shields Avenue, Davis, CA 95616, USA. sltaylor@ucdavis.edu	NA
Pollard KS, Hubisz MJ, Rosenbloom KR, Siepel A	Detection of nonneutral substitution rates on mammalian phylogenies.	Genome Res.	20:1:110-21	2010	19858363		Katherine S Pollard, Melissa J Hubisz, Kate R Rosenbloom, Adam Siepel	Katherine S Pollard	Adam Siepel	Gladstone Institutes, University of California, San Francisco, San Francisco, California 94158, USA. kpollard@gladstone.ucsf.edu	NIGMS NIH HHS; GM82901
Hsieh F, Chen SC, Pollard K	A nearly exhaustive search for CpG islands on whole chromosomes.	Int J Biostat	5:1:	2009	20148132		Fushing Hsieh, Shu-Chun Chen, Katherine Pollard	Fushing Hsieh	Katherine Pollard	Department of Statistics, Mathematical Sciences Building, University of California, Davis, CA 95616, USA. fushing@wald.ucdavis.edu	NIA NIH HHS; R01 AG025218-02
Pollard KS	What makes us human?	Sci. Am.	300:5:44-9	2009	19438048		Katherine S Pollard	Katherine S Pollard	Katherine S Pollard	University of California, San Francisco, USA.	NA
Lemay DG, Lynn DJ, Martin WF, Neville MC, Casey TM, Rincon G, Kriventseva EV, Barris WC, Hinrichs AS, Molenaar AJ, Pollard KS, Maqbool NJ, Singh K, Murney R, Zdobnov EM, Tellam RL, Medrano JF, German JB, Rijnkels M	The bovine lactation genome: insights into the evolution of mammalian milk.	Genome Biol.	10:4:R43	2009	19393040		Danielle G Lemay, David J Lynn, William F Martin, Margaret C Neville, Theresa M Casey, Gonzalo Rincon, Evgenia V Kriventseva, Wesley C Barris, Angie S Hinrichs, Adrian J Molenaar, Katherine S Pollard, Nauman J Maqbool, Kuljeet Singh, Regan Murney, Evgeny M Zdobnov, Ross L Tellam, Juan F Medrano, J Bruce German, Monique Rijnkels	Danielle G Lemay	Monique Rijnkels	Department of Food Science and Technology, University of California Davis, One Shields Avenue, Davis, CA 95616, USA. dglemay@ucdavis.edu	NIEHS NIH HHS; P42 ES04699
Taylor S, Pollard K	Hypothesis tests for point-mass mixture data with application to 'omics data with many zero values.	Stat Appl Genet Mol Biol	8:Article 8	2009	19222391		Sandra Taylor, Katherine Pollard	Sandra Taylor	Katherine Pollard	University of California, Davis, USA. staylor@wald.ucdavis.edu	NA
Berglund J, Pollard KS, Webster MT	Hotspots of biased nucleotide substitutions in human genes.	PLoS Biol.	7:1:e26	2009	19175294		Jonas Berglund, Katherine S Pollard, Matthew T Webster	Jonas Berglund	Matthew T Webster	Department of Medical Biochemistry and Microbiology, Uppsala University, Uppsala, Sweden.	NIGMS NIH HHS; GM82901-01A1
Cozen AE, Weirauch MT, Pollard KS, Bernick DL, Stuart JM, Lowe TM	Transcriptional map of respiratory versatility in the hyperthermophilic crenarchaeon Pyrobaculum aerophilum.	J. Bacteriol.	191:3:782-94	2009	19047344		Aaron E Cozen, Matthew T Weirauch, Katherine S Pollard, David L Bernick, Joshua M Stuart, Todd M Lowe	Aaron E Cozen	Todd M Lowe	Department of Ocean Sciences, University of California Santa Cruz, 1156 High Street, Santa Cruz, California 95064, USA.	NA
Pollard KS, van der Laan MJ	Supervised distance matrices.	Stat Appl Genet Mol Biol	7:1:Article 33	2008	19049489		Katherine S Pollard, Mark J van der Laan	Katherine S Pollard	Mark J van der Laan	University of California, San Francisco, USA. kpollard@gladstone.ucsf.edu	NA
Walker WL, Liao IH, Gilbert DL, Wong B, Pollard KS, McCulloch CE, Lit L, Sharp FR	Empirical Bayes accomodation of batch-effects in microarray data using identical replicate reference samples: application to RNA expression profiling of blood from Duchenne muscular dystrophy patients.	BMC Genomics	9:494	2008	18937867		Wynn L Walker, Isaac H Liao, Donald L Gilbert, Brenda Wong, Katherine S Pollard, Charles E McCulloch, Lisa Lit, Frank R Sharp	Wynn L Walker	Frank R Sharp	Department of Neurology and MIND Institute, University of California at Davis, Sacramento, California, USA. wwalker@ucdavis.edu	NA
Taylor SL, Pollard KS	Evaluation of two methods to estimate and monitor bird populations.	PLoS ONE	3:8:e3047	2008	18728775		Sandra L Taylor, Katherine S Pollard	Sandra L Taylor	Katherine S Pollard	Department of Statistics, University of California Davis, Davis, California, USA. sltaylor@ucdavis.edu	NA
Holloway AK, Begun DJ, Siepel A, Pollard KS	Accelerated sequence divergence of conserved genomic elements in Drosophila melanogaster.	Genome Res.	18:10:1592-601	2008	18583644		Alisha K Holloway, David J Begun, Adam Siepel, Katherine S Pollard	Alisha K Holloway	Katherine S Pollard	Department of Evolution and Ecology and Center for Population Biology, University of California, Davis, California 95691, USA. akholloway@ucdavis.edu	NIGMS NIH HHS; R01-GM071926
Lemay DG, Neville MC, Rudolph MC, Pollard KS, German JB	Gene regulatory networks in lactation: identification of global principles using bioinformatics.	BMC Syst Biol	1:56	2007	18039394		Danielle G Lemay, Margaret C Neville, Michael C Rudolph, Katherine S Pollard, J Bruce German	Danielle G Lemay	J Bruce German	Department of Food Science and Technology, University of California, One Shields Ave,, Davis, CA 95616, USA. dglemay@ucdavis.edu	NIEHS NIH HHS; P42 ES04699
Pollard KS, Serre D, Wang X, Tao H, Grundberg E, Hudson TJ, Clark AG, Frazer K	A genome-wide approach to identifying novel-imprinted genes.	Hum. Genet.	122:6:625-34	2008	17955261		Katherine S Pollard, David Serre, Xu Wang, Heng Tao, Elin Grundberg, Thomas J Hudson, Andrew G Clark, Kelly Frazer	Katherine S Pollard	Kelly Frazer	UC Davis Genome Center and Department of Statistics, University of California, Davis, CA, 95616, USA. kspollard@ucdavis.edu	NA
Dreszer TR, Wall GD, Haussler D, Pollard KS	Biased clustered substitutions in the human genome: the footprints of male-driven biased gene conversion.	Genome Res.	17:10:1420-30	2007	17785536		Timothy R Dreszer, Gregory D Wall, David Haussler, Katherine S Pollard	Timothy R Dreszer	Katherine S Pollard	Department of Biomolecular Engineering, University of California, Santa Cruz, California 95064, USA.	NA
Magalhães TR, Palmer J, Tomancak P, Pollard KS	Transcriptional control in embryonic Drosophila midline guidance assessed through a whole genome approach.	BMC Neurosci	8:59	2007	17672901		Tiago R Magalhães, Jessica Palmer, Pavel Tomancak, Katherine S Pollard	Tiago R Magalhães	Katherine S Pollard	Programa Gulbenkian Doutoramento Biologia e Medicina, Centro Neurociências, Universidade de Coimbra, 3000-Coimbra, Portugal. tiago17@socrates.berkeley.edu	NA
Pollard KS, Salama SR, King B, Kern AD, Dreszer T, Katzman S, Siepel A, Pedersen JS, Bejerano G, Baertsch R, Rosenbloom KR, Kent J, Haussler D	Forces shaping the fastest evolving regions in the human genome.	PLoS Genet.	2:10:e168	2006	17040131		Katherine S Pollard, Sofie R Salama, Bryan King, Andrew D Kern, Tim Dreszer, Sol Katzman, Adam Siepel, Jakob S Pedersen, Gill Bejerano, Robert Baertsch, Kate R Rosenbloom, Jim Kent, David Haussler	Katherine S Pollard	David Haussler	Department of Biomolecular Engineering, University of California Santa Cruz, Santa Cruz, California, United States of America. kspollard@ucdavis.edu	NHGRI NIH HHS; P41 HG02371
Pollard KS, Salama SR, Lambert N, Lambot MA, Coppens S, Pedersen JS, Katzman S, King B, Onodera C, Siepel A, Kern AD, Dehay C, Igel H, Ares M, Vanderhaeghen P, Haussler D	An RNA gene expressed during cortical development evolved rapidly in humans.	Nature	443:7108:167-72	2006	16915236		Katherine S Pollard, Sofie R Salama, Nelle Lambert, Marie-Alexandra Lambot, Sandra Coppens, Jakob S Pedersen, Sol Katzman, Bryan King, Courtney Onodera, Adam Siepel, Andrew D Kern, Colette Dehay, Haller Igel, Manuel Ares, Pierre Vanderhaeghen, David Haussler	Katherine S Pollard	David Haussler	Center for Biomolecular Science & Engineering, Department of Molecular, Cell & Developmental Biology, University of California, Santa Cruz, California 95064, USA.	NA
Beaulieu JP, Bennett DP, Fouqué P, Williams A, Dominik M, Jørgensen UG, Kubas D, Cassan A, Coutures C, Greenhill J, Hill K, Menzies J, Sackett PD, Albrow M, Brillant S, Caldwell JA, Calitz JJ, Cook KH, Corrales E, Desort M, Dieters S, Dominis D, Donatowicz J, Hoffman M, Kane S, Marquette JB, Martin R, Meintjes P, Pollard K, Sahu K, Vinter C, Wambsganss J, Woller K, Horne K, Steele I, Bramich DM, Burgdorf M, Snodgrass C, Bode M, Udalski A, Szymański MK, Kubiak M, Wieckowski T, Pietrzyński G, Soszyński I, Szewczyk O, Wyrzykowski L, Paczyński B, Abe F, Bond IA, Britton TR, Gilmore AC, Hearnshaw JB, Itow Y, Kamiya K, Kilmartin PM, Korpela AV, Masuda K, Matsubara Y, Motomura M, Muraki Y, Nakamura S, Okada C, Ohnishi K, Rattenbury NJ, Sako T, Sato S, Sasaki M, Sekiguchi T, Sullivan DJ, Tristram PJ, Yock PC, Yoshioka T	Discovery of a cool planet of 5.5 Earth masses through gravitational microlensing.	Nature	439:7075:437-40	2006	16437108		J-P Beaulieu, D P Bennett, P Fouqué, A Williams, M Dominik, U G Jørgensen, D Kubas, A Cassan, C Coutures, J Greenhill, K Hill, J Menzies, P D Sackett, M Albrow, S Brillant, J A R Caldwell, J J Calitz, K H Cook, E Corrales, M Desort, S Dieters, D Dominis, J Donatowicz, M Hoffman, S Kane, J-B Marquette, R Martin, P Meintjes, K Pollard, K Sahu, C Vinter, J Wambsganss, K Woller, K Horne, I Steele, D M Bramich, M Burgdorf, C Snodgrass, M Bode, A Udalski, M K Szymański, M Kubiak, T Wieckowski, G Pietrzyński, I Soszyński, O Szewczyk, L Wyrzykowski, B Paczyński, F Abe, I A Bond, T R Britton, A C Gilmore, J B Hearnshaw, Y Itow, K Kamiya, P M Kilmartin, A V Korpela, K Masuda, Y Matsubara, M Motomura, Y Muraki, S Nakamura, C Okada, K Ohnishi, N J Rattenbury, T Sako, S Sato, M Sasaki, T Sekiguchi, D J Sullivan, P J Tristram, P C M Yock, T Yoshioka	J-P Beaulieu	T Yoshioka	PLANET/RoboNet Collaboration, CNRS, Université Pierre et Marie Curie UMR7095, 98bis Boulevard Arago, 75014 Paris, France. beaulieu@iap.fr	NA
Schneider KL, Pollard KS, Baertsch R, Pohl A, Lowe TM	The UCSC Archaeal Genome Browser.	Nucleic Acids Res.	34:Database issue:D407-10	2006	16381898		Kevin L Schneider, Katherine S Pollard, Robert Baertsch, Andy Pohl, Todd M Lowe	Kevin L Schneider	Todd M Lowe	Biomolecular Engineering, University of California Santa Cruz, 1156 High Street, Santa Cruz, CA 95064, USA.	NA
van der Laan MJ, Dudoit S, Pollard KS	Augmentation procedures for control of the generalized family-wise error rate and tail probabilities for the proportion of false positives.	Stat Appl Genet Mol Biol	3:Article15	2004	16646793		Mark J van der Laan, Sandrine Dudoit, Katherine S Pollard	Mark J van der Laan	Katherine S Pollard	Division of Biostatistics, School of Public Health, University of California, Berkeley, USA. laan@stat.berkeley.edu	NA
van der Laan MJ, Dudoit S, Pollard KS	Multiple testing. Part II. Step-down procedures for control of the family-wise error rate.	Stat Appl Genet Mol Biol	3:Article14	2004	16646792		Mark J van der Laan, Sandrine Dudoit, Katherine S Pollard	Mark J van der Laan	Katherine S Pollard	Division of Biostatistics, School of Public Health, University of California, Berkeley, USA. laan@stat.berkeley.edu	NA
Dudoit S, van der Laan MJ, Pollard KS	Multiple testing. Part I. Single-step procedures for control of general type I error rates.	Stat Appl Genet Mol Biol	3:Article13	2004	16646791		Sandrine Dudoit, Mark J van der Laan, Katherine S Pollard	Sandrine Dudoit	Katherine S Pollard	Division of Biostatistics, School of Public Health, University of California, Berkeley, USA. sandrine@stat.berkeley.edu	NA
Pollard KS, van der Laan MJ	Statistical inference for simultaneous clustering of gene expression data.	Math Biosci	176:1:99-121	2002	11867086		Katherine S Pollard, Mark J van der Laan	Katherine S Pollard	Mark J van der Laan	Division of Biostatistics, School of Public Health, University of California, Earl Warren Hall #7360, Berkeley, CA 94720-7360, USA.	NA
Egawa N, Kitaoka S, Tsukita K, Naitoh M, Takahashi K, Yamamoto T, Adachi F, Kondo T, Okita K, Asaka I, Aoi T, Watanabe A, Yamada Y, Morizane A, Takahashi J, Ayaki T, Ito H, Yoshikawa K, Yamawaki S, Suzuki S, Watanabe D, Hioki H, Kaneko T, Makioka K, Okamoto K, Takuma H, Tamaoka A, Hasegawa K, Nonaka T, Hasegawa M, Kawata A, Yoshida M, Nakahata T, Takahashi R, Marchetto MC, Gage FH, Yamanaka S, Inoue H	Response to Comment on "Drug Screening for ALS Using Patient-Specific Induced Pluripotent Stem Cells".	Sci Transl Med	5:188:188lr2	2013	23740898		Naohiro Egawa, Shiho Kitaoka, Kayoko Tsukita, Motoko Naitoh, Kazutoshi Takahashi, Takuya Yamamoto, Fumihiko Adachi, Takayuki Kondo, Keisuke Okita, Isao Asaka, Takashi Aoi, Akira Watanabe, Yasuhiro Yamada, Asuka Morizane, Jun Takahashi, Takashi Ayaki, Hidefumi Ito, Katsuhiro Yoshikawa, Satoko Yamawaki, Shigehiko Suzuki, Dai Watanabe, Hiroyuki Hioki, Takeshi Kaneko, Kouki Makioka, Koichi Okamoto, Hiroshi Takuma, Akira Tamaoka, Kazuko Hasegawa, Takashi Nonaka, Masato Hasegawa, Akihiro Kawata, Minoru Yoshida, Tatsutoshi Nakahata, Ryosuke Takahashi, Maria C N Marchetto, Fred H Gage, Shinya Yamanaka, Haruhisa Inoue	Naohiro Egawa	Haruhisa Inoue	Center for iPS Cell Research and Application (CiRA), Kyoto University, Kyoto 606-8507, Japan.	NA
Takahashi K, Yamanaka S	Induced pluripotent stem cells in medicine and biology.	Development	140:12:2457-61	2013	23715538		Kazutoshi Takahashi, Shinya Yamanaka	Kazutoshi Takahashi	Shinya Yamanaka	Center for iPS Cell Research and Application, Kyoto University, Kyoto, 606-8507, Japan.	NA
Kaneko S, Yamanaka S	To be immunogenic, or not to be: that's the iPSC question.	Cell Stem Cell	12:4:385-6	2013	23561437		Shin Kaneko, Shinya Yamanaka	Shin Kaneko	Shinya Yamanaka	Center for iPS Cell Research and Application, Kyoto University, Kyoto 606-8507, Japan. kaneko.shin@cira.kyoto-u.ac.jp	NA
Okita K, Yamakawa T, Matsumura Y, Sato Y, Amano N, Watanabe A, Goshima N, Yamanaka S	An efficient nonviral method to generate integration-free human-induced pluripotent stem cells from cord blood and peripheral blood cells.	Stem Cells	31:3:458-66	2013	23193063		Keisuke Okita, Tatsuya Yamakawa, Yasuko Matsumura, Yoshiko Sato, Naoki Amano, Akira Watanabe, Naoki Goshima, Shinya Yamanaka	Keisuke Okita	Shinya Yamanaka	Department of Reprogramming Science, Center for iPS Cell Research and Application (CiRA), Kyoto University, Kyoto, Japan. okita-g@cira.kyoto-u.ac.jp	NA
Kondo T, Asai M, Tsukita K, Kutoku Y, Ohsawa Y, Sunada Y, Imamura K, Egawa N, Yahata N, Okita K, Takahashi K, Asaka I, Aoi T, Watanabe A, Watanabe K, Kadoya C, Nakano R, Watanabe D, Maruyama K, Hori O, Hibino S, Choshi T, Nakahata T, Hioki H, Kaneko T, Naitoh M, Yoshikawa K, Yamawaki S, Suzuki S, Hata R, Ueno S, Seki T, Kobayashi K, Toda T, Murakami K, Irie K, Klein WL, Mori H, Asada T, Takahashi R, Iwata N, Yamanaka S, Inoue H	Modeling Alzheimer's disease with iPSCs reveals stress phenotypes associated with intracellular Aβ and differential drug responsiveness.	Cell Stem Cell	12:4:487-96	2013	23434393		Takayuki Kondo, Masashi Asai, Kayoko Tsukita, Yumiko Kutoku, Yutaka Ohsawa, Yoshihide Sunada, Keiko Imamura, Naohiro Egawa, Naoki Yahata, Keisuke Okita, Kazutoshi Takahashi, Isao Asaka, Takashi Aoi, Akira Watanabe, Kaori Watanabe, Chie Kadoya, Rie Nakano, Dai Watanabe, Kei Maruyama, Osamu Hori, Satoshi Hibino, Tominari Choshi, Tatsutoshi Nakahata, Hiroyuki Hioki, Takeshi Kaneko, Motoko Naitoh, Katsuhiro Yoshikawa, Satoko Yamawaki, Shigehiko Suzuki, Ryuji Hata, Shu-Ichi Ueno, Tsuneyoshi Seki, Kazuhiro Kobayashi, Tatsushi Toda, Kazuma Murakami, Kazuhiro Irie, William L Klein, Hiroshi Mori, Takashi Asada, Ryosuke Takahashi, Nobuhisa Iwata, Shinya Yamanaka, Haruhisa Inoue	Takayuki Kondo	Haruhisa Inoue	Center for iPS Cell Research and Application, Kyoto University, Kyoto 606-8507, Japan.	NA
Kamakura T, Makiyama T, Sasaki K, Yoshida Y, Wuriyanghai Y, Chen J, Hattori T, Ohno S, Kita T, Horie M, Yamanaka S, Kimura T	Ultrastructural maturation of human-induced pluripotent stem cell-derived cardiomyocytes in a long-term culture.	Circ. J.	77:5:1307-14	2013	23400258		Tsukasa Kamakura, Takeru Makiyama, Kenichi Sasaki, Yoshinori Yoshida, Yimin Wuriyanghai, Jiarong Chen, Tetsuhisa Hattori, Seiko Ohno, Toru Kita, Minoru Horie, Shinya Yamanaka, Takeshi Kimura	Tsukasa Kamakura	Takeshi Kimura	Department of Cardiovascular Medicine, Kyoto University Graduate School of Medicine, Kyoto, Japan.	NA
Okano H, Nakamura M, Yoshida K, Okada Y, Tsuji O, Nori S, Ikeda E, Yamanaka S, Miura K	Steps toward safe cell therapy using induced pluripotent stem cells.	Circ. Res.	112:3:523-33	2013	23371901		Hideyuki Okano, Masaya Nakamura, Kenji Yoshida, Yohei Okada, Osahiko Tsuji, Satoshi Nori, Eiji Ikeda, Shinya Yamanaka, Kyoko Miura	Hideyuki Okano	Kyoko Miura	Department of Physiology, Keio University School of Medicine, 35 Shinanomachi, Shinjuku, Tokyo 160-8582, Japan. hidokano@a2.keio.jp	NA
