Authors	Title	Journal	Vol:Issue:Page	Year	Pubmed_Id	Citation_Number	Authors_Full_Name	First_Author	LastAuthor	Affiliations	Grants
Boxer AL, Gold M, Huey E, Hu WT, Rosen H, Kramer J, Gao FB, Burton EA, Chow T, Kao A, Leavitt BR, Lamb B, Grether M, Knopman D, Cairns NJ, Mackenzie IR, Mitic L, Roberson ED, Van Kammen D, Cantillon M, Zahs K, Jackson G, Salloway S, Morris J, Tong G, Feldman H, Fillit H, Dickinson S, Khachaturian ZS, Sutherland M, Abushakra S, Lewcock J, Farese R, Kenet RO, Laferla F, Perrin S, Whitaker S, Honig L, Mesulam MM, Boeve B, Grossman M, Miller BL, Cummings JL	The advantages of frontotemporal degeneration drug development (part 2 of frontotemporal degeneration: the next therapeutic frontier).	Alzheimers Dement	9:2:189-98	2013	23062850		Adam L Boxer, Michael Gold, Edward Huey, William T Hu, Howard Rosen, Joel Kramer, Fen-Biao Gao, Edward A Burton, Tiffany Chow, Aimee Kao, Blair R Leavitt, Bruce Lamb, Megan Grether, David Knopman, Nigel J Cairns, Ian R Mackenzie, Laura Mitic, Erik D Roberson, Daniel Van Kammen, Marc Cantillon, Kathleen Zahs, George Jackson, Stephen Salloway, John Morris, Gary Tong, Howard Feldman, Howard Fillit, Susan Dickinson, Zaven S Khachaturian, Margaret Sutherland, Susan Abushakra, Joseph Lewcock, Robert Farese, Robert O Kenet, Frank Laferla, Steve Perrin, Steve Whitaker, Lawrence Honig, Marsel M Mesulam, Brad Boeve, Murray Grossman, Bruce L Miller, Jeffrey L Cummings	Adam L Boxer	Jeffrey L Cummings	Memory and Aging Center, Department of Neurology, University of California, San Francisco, CA, USA. aboxer@memory.ucsf.edu	NIA NIH HHS; R01 AG038791
Martens LH, Zhang J, Barmada SJ, Zhou P, Kamiya S, Sun B, Min SW, Gan L, Finkbeiner S, Huang EJ, Farese RV	Progranulin deficiency promotes neuroinflammation and neuron loss following toxin-induced injury.	J. Clin. Invest.	122:11:3955-9	2012	23041626		Lauren Herl Martens, Jiasheng Zhang, Sami J Barmada, Ping Zhou, Sherry Kamiya, Binggui Sun, Sang-Won Min, Li Gan, Steven Finkbeiner, Eric J Huang, Robert V Farese	Lauren Herl Martens	Robert V Farese	Gladstone Institute of Cardiovascular Disease, San Francisco, California 94158, USA.	NCRR NIH HHS; RR18928
Boxer AL, Gold M, Huey E, Gao FB, Burton EA, Chow T, Kao A, Leavitt BR, Lamb B, Grether M, Knopman D, Cairns NJ, Mackenzie IR, Mitic L, Roberson ED, Van Kammen D, Cantillon M, Zahs K, Salloway S, Morris J, Tong G, Feldman H, Fillit H, Dickinson S, Khachaturian Z, Sutherland M, Farese R, Miller BL, Cummings J	Frontotemporal degeneration, the next therapeutic frontier: molecules and animal models for frontotemporal degeneration drug development.	Alzheimers Dement	9:2:176-88	2013	23043900		Adam L Boxer, Michael Gold, Edward Huey, Fen-Biao Gao, Edward A Burton, Tiffany Chow, Aimee Kao, Blair R Leavitt, Bruce Lamb, Megan Grether, David Knopman, Nigel J Cairns, Ian R Mackenzie, Laura Mitic, Erik D Roberson, Daniel Van Kammen, Marc Cantillon, Kathleen Zahs, Stephen Salloway, John Morris, Gary Tong, Howard Feldman, Howard Fillit, Susan Dickinson, Zaven Khachaturian, Margaret Sutherland, Robert Farese, Bruce L Miller, Jeffrey Cummings	Adam L Boxer	Jeffrey Cummings	Memory and Aging Center, Department of Neurology, University of California, San Francisco, CA, USA. aboxer@memory.ucsf.edu	NIA NIH HHS; R01 AG038791
Xu N, Zhang SO, Cole RA, McKinney SA, Guo F, Haas JT, Bobba S, Farese RV, Mak HY	The FATP1-DGAT2 complex facilitates lipid droplet expansion at the ER-lipid droplet interface.	J. Cell Biol.	198:5:895-911	2012	22927462		Ningyi Xu, Shaobing O Zhang, Ronald A Cole, Sean A McKinney, Fengli Guo, Joel T Haas, Sudheer Bobba, Robert V Farese, Ho Yi Mak	Ningyi Xu	Ho Yi Mak	Stowers Institute for Medical Research, Kansas City, MO 64110, USA.	NIDDK NIH HHS; R01 2R56DK56084
Haas JT, Miao J, Chanda D, Wang Y, Zhao E, Haas ME, Hirschey M, Vaitheesvaran B, Farese RV, Kurland IJ, Graham M, Crooke R, Foufelle F, Biddinger SB	Hepatic insulin signaling is required for obesity-dependent expression of SREBP-1c mRNA but not for feeding-dependent expression.	Cell Metab.	15:6:873-84	2012	22682225		Joel T Haas, Ji Miao, Dipanjan Chanda, Yanning Wang, Enpeng Zhao, Mary E Haas, Matthew Hirschey, B Vaitheesvaran, Robert V Farese, Irwin J Kurland, Mark Graham, Rosanne Crooke, Fabienne Foufelle, Sudha B Biddinger	Joel T Haas	Sudha B Biddinger	Department of Biochemistry and Biophysics, University of California-San Francisco, and Gladstone Institute of Cardiovascular Disease, San Francisco, CA 94158, USA.	NHLBI NIH HHS; R01 HL109650
Farese RV, Zechner R, Newgard CB, Walther TC	The problem of establishing relationships between hepatic steatosis and hepatic insulin resistance.	Cell Metab.	15:5:570-3	2012	22560209		Robert V Farese, Rudolf Zechner, Christopher B Newgard, Tobias C Walther	Robert V Farese	Tobias C Walther	Gladstone Institute of Cardiovascular Disease, Department of Medicine, University of California, San Francisco, CA 94158, USA. bfarese@gladstone.ucsf.edu	NIGMS NIH HHS; R01 GM097194
Walther TC, Farese RV	Lipid droplets and cellular lipid metabolism.	Annu. Rev. Biochem.	81:687-714	2012	22524315		Tobias C Walther, Robert V Farese	Tobias C Walther	Robert V Farese	Department of Cell Biology, Yale University School of Medicine, New Haven, Connecticut 06520, USA. tobias.walther@yale.edu	NIGMS NIH HHS; R01 GM097194
Zhang J, Kelley KL, Marshall SM, Davis MA, Wilson MD, Sawyer JK, Farese RV, Brown JM, Rudel LL	Tissue-specific knockouts of ACAT2 reveal that intestinal depletion is sufficient to prevent diet-induced cholesterol accumulation in the liver and blood.	J. Lipid Res.	53:6:1144-52	2012	22460046		Jun Zhang, Kathryn L Kelley, Stephanie M Marshall, Matthew A Davis, Martha D Wilson, Janet K Sawyer, Robert V Farese, J Mark Brown, Lawrence L Rudel	Jun Zhang	Lawrence L Rudel	Section on Lipid Sciences, Department of Pathology, Wake Forest University School of Medicine, Winston-Salem, NC 27157, USA.	NHLBI NIH HHS; R01-HL51710
Streeper RS, Grueter CA, Salomonis N, Cases S, Levin MC, Koliwad SK, Zhou P, Hirschey MD, Verdin E, Farese RV	Deficiency of the lipid synthesis enzyme, DGAT1, extends longevity in mice.	Aging (Albany NY)	4:1:13-27	2012	22291164		Ryan S Streeper, Carrie A Grueter, Nathan Salomonis, Sylvaine Cases, Malin C Levin, Suneil K Koliwad, Ping Zhou, Mattew D Hirschey, Eric Verdin, Robert V Farese	Ryan S Streeper	Robert V Farese	Gladstone Institute of Cardiovascular Disease, San Francisco, California, USA.	NIDDK NIH HHS; R01-DK056084
Tschöp MH, Speakman JR, Arch JR, Auwerx J, Brüning JC, Chan L, Eckel RH, Farese RV, Galgani JE, Hambly C, Herman MA, Horvath TL, Kahn BB, Kozma SC, Maratos-Flier E, Müller TD, Münzberg H, Pfluger PT, Plum L, Reitman ML, Rahmouni K, Shulman GI, Thomas G, Kahn CR, Ravussin E	A guide to analysis of mouse energy metabolism.	Nat. Methods	9:1:57-63	2012	22205519		Matthias H Tschöp, John R Speakman, Jonathan R S Arch, Johan Auwerx, Jens C Brüning, Lawrence Chan, Robert H Eckel, Robert V Farese, Jose E Galgani, Catherine Hambly, Mark A Herman, Tamas L Horvath, Barbara B Kahn, Sara C Kozma, Eleftheria Maratos-Flier, Timo D Müller, Heike Münzberg, Paul T Pfluger, Leona Plum, Marc L Reitman, Kamal Rahmouni, Gerald I Shulman, George Thomas, C Ronald Kahn, Eric Ravussin	Matthias H Tschöp	Eric Ravussin	Institute for Diabetes and Obesity, Helmholz Centre Munich, Department of Medicine, Technical University of Munich, Munich, Germany.	NIDDK NIH HHS; R37 DK043051
Hirschey MD, Shimazu T, Jing E, Grueter CA, Collins AM, Aouizerat B, Stančáková A, Goetzman E, Lam MM, Schwer B, Stevens RD, Muehlbauer MJ, Kakar S, Bass NM, Kuusisto J, Laakso M, Alt FW, Newgard CB, Farese RV, Kahn CR, Verdin E	SIRT3 deficiency and mitochondrial protein hyperacetylation accelerate the development of the metabolic syndrome.	Mol. Cell	44:2:177-90	2011	21856199		Matthew D Hirschey, Tadahiro Shimazu, Enxuan Jing, Carrie A Grueter, Amy M Collins, Bradley Aouizerat, Alena Stančáková, Eric Goetzman, Maggie M Lam, Bjoern Schwer, Robert D Stevens, Michael J Muehlbauer, Sanjay Kakar, Nathan M Bass, Johanna Kuusisto, Markku Laakso, Frederick W Alt, Christopher B Newgard, Robert V Farese, C Ronald Kahn, Eric Verdin	Matthew D Hirschey	Eric Verdin	Gladstone Institute of Virology and Immunology, San Francisco, CA 94158, USA.	Howard Hughes Medical Institute; 
Harris C, Herker E, Farese RV, Ott M	Hepatitis C virus core protein decreases lipid droplet turnover: a mechanism for core-induced steatosis.	J. Biol. Chem.	286:49:42615-25	2011	21984835		Charles Harris, Eva Herker, Robert V Farese, Melanie Ott	Charles Harris	Melanie Ott	Gladstone Institute of Cardiovascular Disease, University of California, San Francisco, California 94158, USA.	NIAID NIH HHS; R56 AI085056
Krahmer N, Guo Y, Wilfling F, Hilger M, Lingrell S, Heger K, Newman HW, Schmidt-Supprian M, Vance DE, Mann M, Farese RV, Walther TC	Phosphatidylcholine synthesis for lipid droplet expansion is mediated by localized activation of CTP:phosphocholine cytidylyltransferase.	Cell Metab.	14:4:504-15	2011	21982710		Natalie Krahmer, Yi Guo, Florian Wilfling, Maximiliane Hilger, Susanne Lingrell, Klaus Heger, Heather W Newman, Marc Schmidt-Supprian, Dennis E Vance, Matthias Mann, Robert V Farese, Tobias C Walther	Natalie Krahmer	Tobias C Walther	Department of Cell Biology, Yale University School of Medicine, New Haven, CT 06520, USA.	Canadian Institutes of Health Research; 
Rosen EY, Wexler EM, Versano R, Coppola G, Gao F, Winden KD, Oldham MC, Martens LH, Zhou P, Farese RV, Geschwind DH	Functional genomic analyses identify pathways dysregulated by progranulin deficiency, implicating Wnt signaling.	Neuron	71:6:1030-42	2011	21943601		Ezra Y Rosen, Eric M Wexler, Revital Versano, Giovanni Coppola, Fuying Gao, Kellen D Winden, Michael C Oldham, Lauren Herl Martens, Ping Zhou, Robert V Farese, Daniel H Geschwind	Ezra Y Rosen	Daniel H Geschwind	Interdepartmental Program for Neuroscience, University of California Los Angeles, Los Angeles, CA 90095, USA.	NIMH NIH HHS; T32 MH073526-01A1
Monetti M, Levin MC, Watt MJ, Hubbard BK, Newgard C, Farese RV, Hevener AL, Farese RV	Hepatic acyl-CoA:diacylglcyerol acyltransferase (DGAT) overexpression, diacylglycerol, and insulin sensitivity.	Proc. Natl. Acad. Sci. U.S.A.	108:34:E523; author reply E524	2011	21807991		Mara Monetti, Malin C Levin, Matthew J Watt, Brian K Hubbard, Christopher Newgard, Robert V Farese, Andrea L Hevener, Robert V Farese	Mara Monetti	Robert V Farese		NA
Cenik B, Sephton CF, Dewey CM, Xian X, Wei S, Yu K, Niu W, Coppola G, Coughlin SE, Lee SE, Dries DR, Almeida S, Geschwind DH, Gao FB, Miller BL, Farese RV, Posner BA, Yu G, Herz J	Suberoylanilide hydroxamic acid (vorinostat) up-regulates progranulin transcription: rational therapeutic approach to frontotemporal dementia.	J. Biol. Chem.	286:18:16101-8	2011	21454553		Basar Cenik, Chantelle F Sephton, Colleen M Dewey, Xunde Xian, Shuguang Wei, Kimberley Yu, Wenze Niu, Giovanni Coppola, Sarah E Coughlin, Suzee E Lee, Daniel R Dries, Sandra Almeida, Daniel H Geschwind, Fen-Biao Gao, Bruce L Miller, Robert V Farese, Bruce A Posner, Gang Yu, Joachim Herz	Basar Cenik	Joachim Herz	Department of Neuroscience, University of Texas Southwestern Medical Center at Dallas, Dallas, Texas 75390-9111, USA.	NHLBI NIH HHS; R37 HL063762-13
Kao AW, Eisenhut RJ, Martens LH, Nakamura A, Huang A, Bagley JA, Zhou P, de Luis A, Neukomm LJ, Cabello J, Farese RV, Kenyon C	A neurodegenerative disease mutation that accelerates the clearance of apoptotic cells.	Proc. Natl. Acad. Sci. U.S.A.	108:11:4441-6	2011	21368173		Aimee W Kao, Robin J Eisenhut, Lauren Herl Martens, Ayumi Nakamura, Anne Huang, Josh A Bagley, Ping Zhou, Alberto de Luis, Lukas J Neukomm, Juan Cabello, Robert V Farese, Cynthia Kenyon	Aimee W Kao	Cynthia Kenyon	Departments of Biochemistry and Biophysics, University of California, San Francisco, CA 94158, USA.	NIA NIH HHS; R37 AG011816-19
Harris CA, Haas JT, Streeper RS, Stone SJ, Kumari M, Yang K, Han X, Brownell N, Gross RW, Zechner R, Farese RV	DGAT enzymes are required for triacylglycerol synthesis and lipid droplets in adipocytes.	J. Lipid Res.	52:4:657-67	2011	21317108		Charles A Harris, Joel T Haas, Ryan S Streeper, Scot J Stone, Manju Kumari, Kui Yang, Xianlin Han, Nicholas Brownell, Richard W Gross, Rudolf Zechner, Robert V Farese	Charles A Harris	Robert V Farese	Gladstone Institute for Cardiovascular Disease, Department of Medicine, University of California, San Francisco, CA 94158, USA. charris@gladstone.ucsf.edu	NIDDK NIH HHS; R01-DK-056084
Bewersdorf J, Farese RV, Walther TC	A new way to look at fat.	Nat. Methods	8:2:132-3	2011	21278725		Joerg Bewersdorf, Robert V Farese, Tobias C Walther	Joerg Bewersdorf	Tobias C Walther		NA
Herker E, Harris C, Hernandez C, Carpentier A, Kaehlcke K, Rosenberg AR, Farese RV, Ott M	Efficient hepatitis C virus particle formation requires diacylglycerol acyltransferase-1.	Nat. Med.	16:11:1295-8	2010	20935628		Eva Herker, Charles Harris, Céline Hernandez, Arnaud Carpentier, Katrin Kaehlcke, Arielle R Rosenberg, Robert V Farese, Melanie Ott	Eva Herker	Melanie Ott	Gladstone Institute of Virology and Immunology, University of California, San Francisco, USA.	NIAID NIH HHS; R03 AI069090
Jiao J, Herl LD, Farese RV, Gao FB	MicroRNA-29b regulates the expression level of human progranulin, a secreted glycoprotein implicated in frontotemporal dementia.	PLoS ONE	5:5:e10551	2010	20479936		Jian Jiao, Lauren D Herl, Robert V Farese, Fen-Biao Gao	Jian Jiao	Fen-Biao Gao	Gladstone Institute of Neurological Disease, Department of Neurology, University of California San Francisco, San Francisco, California, United States of America.	NINDS NIH HHS; NS066586
Hirschey MD, Shimazu T, Goetzman E, Jing E, Schwer B, Lombard DB, Grueter CA, Harris C, Biddinger S, Ilkayeva OR, Stevens RD, Li Y, Saha AK, Ruderman NB, Bain JR, Newgard CB, Farese RV, Alt FW, Kahn CR, Verdin E	SIRT3 regulates mitochondrial fatty-acid oxidation by reversible enzyme deacetylation.	Nature	464:7285:121-5	2010	20203611		Matthew D Hirschey, Tadahiro Shimazu, Eric Goetzman, Enxuan Jing, Bjoern Schwer, David B Lombard, Carrie A Grueter, Charles Harris, Sudha Biddinger, Olga R Ilkayeva, Robert D Stevens, Yu Li, Asish K Saha, Neil B Ruderman, James R Bain, Christopher B Newgard, Robert V Farese, Frederick W Alt, C Ronald Kahn, Eric Verdin	Matthew D Hirschey	Eric Verdin	Gladstone Institute of Virology and Immunology, San Francisco, California 94158, USA.	Howard Hughes Medical Institute; 
Koliwad SK, Streeper RS, Monetti M, Cornelissen I, Chan L, Terayama K, Naylor S, Rao M, Hubbard B, Farese RV	DGAT1-dependent triacylglycerol storage by macrophages protects mice from diet-induced insulin resistance and inflammation.	J. Clin. Invest.	120:3:756-67	2010	20124729		Suneil K Koliwad, Ryan S Streeper, Mara Monetti, Ivo Cornelissen, Liana Chan, Koji Terayama, Stephen Naylor, Meghana Rao, Brian Hubbard, Robert V Farese	Suneil K Koliwad	Robert V Farese	Gladstone Institute of Cardiovascular Disease, San Francisco, California 94158, USA. skoliwad@gladstone.ucsf.edu	NIDDK NIH HHS; DK08174-01
Farese RV, Walther TC	Lipid droplets finally get a little R-E-S-P-E-C-T.	Cell	139:5:855-60	2009	19945371		Robert V Farese, Tobias C Walther	Robert V Farese	Tobias C Walther	Gladstone Institute of Cardiovascular Disease, San Francisco, CA 94158, USA. bfarese@gladstone.ucsf.edu	NIDDK NIH HHS; R01 DK056084-09
Krahmer N, Guo Y, Farese RV, Walther TC	SnapShot: Lipid Droplets.	Cell	139:5:1024-1024.e1	2009	19945384		Natalie Krahmer, Yi Guo, Robert V Farese, Tobias C Walther	Natalie Krahmer	Tobias C Walther	Max Planck Institute of Biochemistry, Martinsried 82152, Germany.	NA
Villanueva CJ, Monetti M, Shih M, Zhou P, Watkins SM, Bhanot S, Farese RV	Specific role for acyl CoA:Diacylglycerol acyltransferase 1 (Dgat1) in hepatic steatosis due to exogenous fatty acids.	Hepatology	50:2:434-42	2009	19472314		Claudio J Villanueva, Mara Monetti, Michelle Shih, Ping Zhou, Steve M Watkins, Sanjay Bhanot, Robert V Farese	Claudio J Villanueva	Robert V Farese	Gladstone Institute of Cardiovascular Disease, University of California, San Francisco, CA 94158, USA.	NIDDK NIH HHS; R01-DK056084
Koliwad SK, Kuo T, Shipp LE, Gray NE, Backhed F, So AY, Farese RV, Wang JC	Angiopoietin-like 4 (ANGPTL4, fasting-induced adipose factor) is a direct glucocorticoid receptor target and participates in glucocorticoid-regulated triglyceride metabolism.	J. Biol. Chem.	284:38:25593-601	2009	19628874		Suneil K Koliwad, Taiyi Kuo, Lauren E Shipp, Nora E Gray, Fredrik Backhed, Alex Yick-Lun So, Robert V Farese, Jen-Chywan Wang	Suneil K Koliwad	Jen-Chywan Wang	Gladstone Institute of Cardiovascular Disease, University of California, San Francisco, California 94143, USA.	NA
Guo Y, Cordes KR, Farese RV, Walther TC	Lipid droplets at a glance.	J. Cell. Sci.	122:Pt 6:749-52	2009	19261844		Yi Guo, Kimberly R Cordes, Robert V Farese, Tobias C Walther	Yi Guo	Tobias C Walther	Gladstone Institute of Cardiovascular Disease, 1650 Owens Street, San Francisco, CA 94158, USA. yguo@gladstone.ucsf.edu	NIDDK NIH HHS; R21 DK078254
Yen CL, Cheong ML, Grueter C, Zhou P, Moriwaki J, Wong JS, Hubbard B, Marmor S, Farese RV	Deficiency of the intestinal enzyme acyl CoA:monoacylglycerol acyltransferase-2 protects mice from metabolic disorders induced by high-fat feeding.	Nat. Med.	15:4:442-6	2009	19287392		Chi-Liang Eric Yen, Mei-Leng Cheong, Carrie Grueter, Ping Zhou, Junya Moriwaki, Jinny S Wong, Brian Hubbard, Stephen Marmor, Robert V Farese	Chi-Liang Eric Yen	Robert V Farese	Gladstone Institute of Cardiovascular Disease, San Francisco, California, USA.	NIDDK NIH HHS; R01 DK056084-01A1
Stone SJ, Levin MC, Zhou P, Han J, Walther TC, Farese RV	The endoplasmic reticulum enzyme DGAT2 is found in mitochondria-associated membranes and has a mitochondrial targeting signal that promotes its association with mitochondria.	J. Biol. Chem.	284:8:5352-61	2009	19049983		Scot J Stone, Malin C Levin, Ping Zhou, Jiayi Han, Tobias C Walther, Robert V Farese	Scot J Stone	Robert V Farese	Department of Biochemistry, University of Saskatchewan, Saskatoon, Saskatchewan S7N 5E5, Canada.	NCI NIH HHS; CO6RR018928
Shih MY, Kane MA, Zhou P, Yen CL, Streeper RS, Napoli JL, Farese RV	Retinol Esterification by DGAT1 Is Essential for Retinoid Homeostasis in Murine Skin.	J. Biol. Chem.	284:7:4292-9	2009	19028692		Michelle Y S Shih, Maureen A Kane, Ping Zhou, C L Eric Yen, Ryan S Streeper, Joseph L Napoli, Robert V Farese	Michelle Y S Shih	Robert V Farese	Gladstone Institute of Cardiovascular Disease, San Francisco, California 94158, USA.	NIDDK NIH HHS; DK36870
Walther TC, Farese RV	The life of lipid droplets.	Biochim. Biophys. Acta	1791:6:459-66	2009	19041421		Tobias C Walther, Robert V Farese	Tobias C Walther	Robert V Farese	Organelle Architecture and Dynamics, Max Planck Institute of Biochemistry, Martinsried, Germany. twalther@biochem.mpg.de	NIDDK NIH HHS; R21-DK78254
Yen CL, Stone SJ, Koliwad S, Harris C, Farese RV	Thematic review series: glycerolipids. DGAT enzymes and triacylglycerol biosynthesis.	J. Lipid Res.	49:11:2283-301	2008	18757836		Chi-Liang Eric Yen, Scot J Stone, Suneil Koliwad, Charles Harris, Robert V Farese	Chi-Liang Eric Yen	Robert V Farese	Department of Nutritional Sciences, University of Wisconsin, Madison, WI 53706, USA.	NIDDK NIH HHS; R01 DK056084-01A1
Minehira K, Young SG, Villanueva CJ, Yetukuri L, Oresic M, Hellerstein MK, Farese RV, Horton JD, Preitner F, Thorens B, Tappy L	Blocking VLDL secretion causes hepatic steatosis but does not affect peripheral lipid stores or insulin sensitivity in mice.	J. Lipid Res.	49:9:2038-44	2008	18515909		Kaori Minehira, Stephen G Young, Claudio J Villanueva, Laxman Yetukuri, Matej Oresic, Mark K Hellerstein, Robert V Farese, Jay D Horton, Frederic Preitner, Bernard Thorens, Luc Tappy	Kaori Minehira	Luc Tappy	Gladstone Institute of Cardiovascular Disease, University of California-San Francisco, CA 94158, USA. kaori.minehira@unil.ch	NHLBI NIH HHS; R01 HL087228-04
Guo Y, Walther TC, Rao M, Stuurman N, Goshima G, Terayama K, Wong JS, Vale RD, Walter P, Farese RV	Functional genomic screen reveals genes involved in lipid-droplet formation and utilization.	Nature	453:7195:657-61	2008	18408709		Yi Guo, Tobias C Walther, Meghana Rao, Nico Stuurman, Gohta Goshima, Koji Terayama, Jinny S Wong, Ronald D Vale, Peter Walter, Robert V Farese	Yi Guo	Robert V Farese	Department of Biochemistry and Biophysics, University of California, San Francisco, California 94158, USA.	Howard Hughes Medical Institute; 
Levin MC, Monetti M, Watt MJ, Sajan MP, Stevens RD, Bain JR, Newgard CB, Farese RV, Farese RV	Increased lipid accumulation and insulin resistance in transgenic mice expressing DGAT2 in glycolytic (type II) muscle.	Am. J. Physiol. Endocrinol. Metab.	293:6:E1772-81	2007	17940217		Malin C Levin, Mara Monetti, Matthew J Watt, Mini P Sajan, Robert D Stevens, James R Bain, Christopher B Newgard, Robert V Farese, Robert V Farese	Malin C Levin	Robert V Farese	Gladstone Institute of Cardiovascular Disease, 1650 Owens St., San Francisco, CA 94158, USA.	NIDDK NIH HHS; R01 DK065969
Lombard DB, Alt FW, Cheng HL, Bunkenborg J, Streeper RS, Mostoslavsky R, Kim J, Yancopoulos G, Valenzuela D, Murphy A, Yang Y, Chen Y, Hirschey MD, Bronson RT, Haigis M, Guarente LP, Farese RV, Weissman S, Verdin E, Schwer B	Mammalian Sir2 homolog SIRT3 regulates global mitochondrial lysine acetylation.	Mol. Cell. Biol.	27:24:8807-14	2007	17923681		David B Lombard, Frederick W Alt, Hwei-Ling Cheng, Jakob Bunkenborg, Ryan S Streeper, Raul Mostoslavsky, Jennifer Kim, George Yancopoulos, David Valenzuela, Andrew Murphy, Yinhua Yang, Yaohui Chen, Matthew D Hirschey, Roderick T Bronson, Marcia Haigis, Leonard P Guarente, Robert V Farese, Sherman Weissman, Eric Verdin, Bjoern Schwer	David B Lombard	Bjoern Schwer	Howard Hughes Medical Institute, The Children's Hospital, Harvard Medical School, Boston, MA 02115, USA.	NCRR NIH HHS; 1C06RR18928
Chan LC, Peters W, Xu Y, Chun J, Farese RV, Cases S	LPA3 receptor mediates chemotaxis of immature murine dendritic cells to unsaturated lysophosphatidic acid (LPA).	J. Leukoc. Biol.	82:5:1193-200	2007	17709403		Liana C Chan, Wendy Peters, Yan Xu, Jerold Chun, Robert V Farese, Sylvaine Cases	Liana C Chan	Sylvaine Cases	Gladstone Institute of Cardiovascular Disease, San Francisco, CA 94158, USA.	NCI NIH HHS; R21 CA109291
Monetti M, Levin MC, Watt MJ, Sajan MP, Marmor S, Hubbard BK, Stevens RD, Bain JR, Newgard CB, Farese RV, Hevener AL, Farese RV	Dissociation of hepatic steatosis and insulin resistance in mice overexpressing DGAT in the liver.	Cell Metab.	6:1:69-78	2007	17618857		Mara Monetti, Malin C Levin, Matthew J Watt, Mini P Sajan, Stephen Marmor, Brian K Hubbard, Robert D Stevens, James R Bain, Christopher B Newgard, Robert V Farese, Andrea L Hevener, Robert V Farese	Mara Monetti	Robert V Farese	Gladstone Institute of Cardiovascular Disease, 1650 Owens Street, San Francisco, CA 94158, USA.	NIDDK NIH HHS; R01-DK065599
Stone SJ, Levin MC, Farese RV	Membrane topology and identification of key functional amino acid residues of murine acyl-CoA:diacylglycerol acyltransferase-2.	J. Biol. Chem.	281:52:40273-82	2006	17035227		Scot J Stone, Malin C Levin, Robert V Farese	Scot J Stone	Robert V Farese	Gladstone Institute of Cardiovascular Disease, San Francisco, California 94158, USA. sstone@gladstone.ucsf.edu	NIDDK NIH HHS; 5R01-DK065599
Feldman BJ, Streeper RS, Farese RV, Yamamoto KR	Myostatin modulates adipogenesis to generate adipocytes with favorable metabolic effects.	Proc. Natl. Acad. Sci. U.S.A.	103:42:15675-80	2006	17030820		Brian J Feldman, Ryan S Streeper, Robert V Farese, Keith R Yamamoto	Brian J Feldman	Keith R Yamamoto	Department of Pediatrics, University of California, San Francisco, CA 94143, USA.	NIDDK NIH HHS; DK73697
Farese RV	The nine lives of ACAT inhibitors.	Arterioscler. Thromb. Vasc. Biol.	26:8:1684-6	2006	16857957		Robert V Farese	Robert V Farese	Robert V Farese		NA
Millar JS, Stone SJ, Tietge UJ, Tow B, Billheimer JT, Wong JS, Hamilton RL, Farese RV, Rader DJ	Short-term overexpression of DGAT1 or DGAT2 increases hepatic triglyceride but not VLDL triglyceride or apoB production.	J. Lipid Res.	47:10:2297-305	2006	16877777		John S Millar, Scot J Stone, Uwe J F Tietge, Bryan Tow, Jeffrey T Billheimer, Jinny S Wong, Robert L Hamilton, Robert V Farese, Daniel J Rader	John S Millar	Daniel J Rader	Department of Pharmacology, University of Pennsylvania, Philadelphia, PA, USA. jsmillar@mail.med.upenn.edu	NHLBI NIH HHS; HL-10365
Rudel LL, Farese RV	ACAT inhibition and the progression of coronary atherosclerosis.	N. Engl. J. Med.	354:24:2616-7; author reply 2616-7	2006	16775245		Lawrence L Rudel, Robert V Farese	Lawrence L Rudel	Robert V Farese		NA
Yen CL, Farese RV	Fat breakdown: a function for CGI-58 (ABHD5) provides a new piece of the puzzle.	Cell Metab.	3:5:305-7	2006	16679288		Chi-Liang Eric Yen, Robert V Farese	Chi-Liang Eric Yen	Robert V Farese	Gladstone Institute of Cardiovascular Disease, San Francisco, CA 94158, USA.	NA
Streeper RS, Koliwad SK, Villanueva CJ, Farese RV	Effects of DGAT1 deficiency on energy and glucose metabolism are independent of adiponectin.	Am. J. Physiol. Endocrinol. Metab.	291:2:E388-94	2006	16595853		Ryan S Streeper, Suneil K Koliwad, Claudio J Villanueva, Robert V Farese	Ryan S Streeper	Robert V Farese	Gladstone Institute of Cardiovascular Disease, San Francisco, CA 94158, USA.	NIDDK NIH HHS; R01-DK-56084
Yen CL, Brown CH, Monetti M, Farese RV	A human skin multifunctional O-acyltransferase that catalyzes the synthesis of acylglycerols, waxes, and retinyl esters.	J. Lipid Res.	46:11:2388-97	2005	16106050		Chi-Liang Eric Yen, Charles H Brown, Mara Monetti, Robert V Farese	Chi-Liang Eric Yen	Robert V Farese	Gladstone Institute of Cardiovascular Disease, San Francisco, CA 94158, USA. eyen@gladstone.ucsf.edu	NIDDK NIH HHS; R01 DK056084
